line_idx,text,,,,
571,"By the name of most kind hostess, and shut up",,,,
572,In measureless content.,,,,
573,"Being unprepared,",,,,
574,"Our will became the servant to defect,",,,,
575,Which else should free have wrought.,,,,
576,All’s well.,,,,
577,I dreamt last night of the three Weïrd Sisters.,,,,
578,To you they have showed some truth.,,,,
579,I think not of,,,,
580,them.,,,,
581,"Yet, when we can entreat an hour to serve,",,,,
582,We would spend it in some words upon that,,,,
583,"business,",,,,
584,If you would grant the time.,,,,
585,At your kind’st leisure.,,,,
586,"If you shall cleave to my consent, when ’tis,",,,,
587,It shall make honor for you.,,,,
588,So I lose none,,,,
589,"In seeking to augment it, but still keep",,,,
590,"My bosom franchised and allegiance clear,",,,,
591,I shall be counseled.,,,,
592,Good repose the while.,,,,
593,"Thanks, sir. The like to you.",,,,
594,"Go bid thy mistress, when my drink is ready,",,,,
595,She strike upon the bell. Get thee to bed.,,,,
596,"Is this a dagger which I see before me,",,,,
597,"The handle toward my hand? Come, let me clutch",,,,
598,thee.,,,,
599,"I have thee not, and yet I see thee still.",,,,
600,"Art thou not, fatal vision, sensible",,,,
601,To feeling as to sight? Or art thou but,,,,
602,"A dagger of the mind, a false creation",,,,
603,Proceeding from the heat-oppressèd brain?,,,,
604,"I see thee yet, in form as palpable",,,,
605,As this which now I draw.,,,,
606,"Thou marshal’st me the way that I was going,",,,,
607,And such an instrument I was to use.,,,,
608,Mine eyes are made the fools o’ th’ other senses,,,,
609,"Or else worth all the rest. I see thee still,",,,,
610,"And, on thy blade and dudgeon, gouts of blood,",,,,
611,Which was not so before. There’s no such thing.,,,,
612,It is the bloody business which informs,,,,
613,Thus to mine eyes. Now o’er the one-half world,,,,
614,"Nature seems dead, and wicked dreams abuse",,,,
615,The curtained sleep. Witchcraft celebrates,,,,
616,"Pale Hecate’s off’rings, and withered murder,",,,,
617,"Alarumed by his sentinel, the wolf,",,,,
618,"Whose howl’s his watch, thus with his stealthy pace,",,,,
619,"With Tarquin’s ravishing strides, towards his",,,,
620,design,,,,
621,"Moves like a ghost. Thou sure and firm-set earth,",,,,
622,"Hear not my steps, which way they walk, for fear",,,,
623,Thy very stones prate of my whereabouts,,,,
624,"And take the present horror from the time,",,,,
625,"Which now suits with it. Whiles I threat, he lives.",,,,
626,Words to the heat of deeds too cold breath gives.,,,,
627,"I go, and it is done. The bell invites me.",,,,
628,"Hear it not, Duncan, for it is a knell",,,,
629,That summons thee to heaven or to hell.,,,,
630,That which hath made them drunk hath made me,,,,
631,bold.,,,,
632,What hath quenched them hath given me fire.,,,,
633,Hark!—Peace.,,,,
634,"It was the owl that shrieked, the fatal bellman,",,,,
635,Which gives the stern’st good-night. He is about it.,,,,
636,"The doors are open, and the surfeited grooms",,,,
637,Do mock their charge with snores. I have drugged,,,,
638,"their possets,",,,,
639,That death and nature do contend about them,,,,
640,Whether they live or die.,,,,
641,"Who’s there? what, ho!",,,,
642,"Alack, I am afraid they have awaked,",,,,
643,And ’tis not done. Th’ attempt and not the deed,,,,
644,Confounds us. Hark!—I laid their daggers ready;,,,,
645,He could not miss ’em. Had he not resembled,,,,
646,"My father as he slept, I had done ’t.",,,,
647,My husband?,,,,
648,I have done the deed. Didst thou not hear a noise?,,,,
649,I heard the owl scream and the crickets cry.,,,,
650,Did not you speak?,,,,
651,When?,,,,
652,Now.,,,,
653,As I descended?,,,,
654,Ay.,,,,
655,Hark!—Who lies i’ th’ second chamber?,,,,
656,Donalbain.,,,,
657,This is a sorry sight.,,,,
658,"A foolish thought, to say a sorry sight.",,,,
659,"There’s one did laugh in ’s sleep, and one cried",,,,
660,Murder!,,,,
661,That they did wake each other. I stood and heard,,,,
662,them.,,,,
663,But they did say their prayers and addressed them,,,,
664,Again to sleep.,,,,
665,There are two lodged together.,,,,
666,"One cried God bless us and Amen the other,",,,,
667,"As they had seen me with these hangman’s hands,",,,,
668,List’ning their fear. I could not say Amen,,,,
669,When they did say God bless us.,,,,
670,Consider it not so deeply.,,,,
671,But wherefore could not I pronounce Amen?,,,,
672,"I had most need of blessing, and Amen",,,,
673,Stuck in my throat.,,,,
674,These deeds must not be thought,,,,
675,"After these ways; so, it will make us mad.",,,,
676,Methought I heard a voice cry Sleep no more!,,,,
677,"Macbeth does murder sleep—the innocent sleep,",,,,
678,"Sleep that knits up the raveled sleave of care,",,,,
679,"The death of each day’s life, sore labor’s bath,",,,,
680,"Balm of hurt minds, great nature’s second course,",,,,
681,Chief nourisher in life’s feast.,,,,
682,What do you mean?,,,,
683,Still it cried Sleep no more! to all the house.,,,,
684,"Glamis hath murdered sleep, and therefore",,,,
685,Cawdor,,,,
686,Shall sleep no more. Macbeth shall sleep no more.,,,,
687,"Who was it that thus cried? Why, worthy thane,",,,,
688,You do unbend your noble strength to think,,,,
689,So brainsickly of things. Go get some water,,,,
690,And wash this filthy witness from your hand.—,,,,
691,Why did you bring these daggers from the place?,,,,
692,"They must lie there. Go, carry them and smear",,,,
693,The sleepy grooms with blood.,,,,
694,I’ll go no more.,,,,
695,I am afraid to think what I have done.,,,,
696,Look on ’t again I dare not.,,,,
697,Infirm of purpose!,,,,
698,Give me the daggers. The sleeping and the dead,,,,
699,Are but as pictures. ’Tis the eye of childhood,,,,
700,"That fears a painted devil. If he do bleed,",,,,
701,"I’ll gild the faces of the grooms withal,",,,,
702,For it must seem their guilt.,,,,
703,Whence is that,,,,
704,knocking?,,,,
705,How is ’t with me when every noise appalls me?,,,,
706,"What hands are here! Ha, they pluck out mine eyes.",,,,
707,Will all great Neptune’s ocean wash this blood,,,,
708,"Clean from my hand? No, this my hand will rather",,,,
709,"The multitudinous seas incarnadine,",,,,
710,Making the green one red.,,,,
711,"My hands are of your color, but I shame",,,,
712,To wear a heart so white.,,,,
713,I hear a knocking,,,,
714,At the south entry. Retire we to our chamber.,,,,
715,A little water clears us of this deed.,,,,
716,"How easy is it, then! Your constancy",,,,
717,Hath left you unattended.,,,,
718,"Hark, more knocking.",,,,
719,"Get on your nightgown, lest occasion call us",,,,
720,And show us to be watchers. Be not lost,,,,
721,So poorly in your thoughts.,,,,
722,To know my deed ’twere best not know myself.,,,,
723,Wake Duncan with thy knocking. I would thou,,,,
724,couldst.,,,,
725,Here’s a knocking indeed! If a man were,,,,
726,"porter of hell gate, he should have old turning the",,,,
727,"key. Knock, knock, knock! Who’s there, i’",,,,
728,th’ name of Beelzebub? Here’s a farmer that hanged,,,,
729,himself on th’ expectation of plenty. Come in time!,,,,
730,Have napkins enough about you; here you’ll sweat,,,,
731,"for ’t. Knock, knock! Who’s there, in th’",,,,
732,"other devil’s name? Faith, here’s an equivocator",,,,
733,that could swear in both the scales against either,,,,
734,"scale, who committed treason enough for God’s",,,,
735,"sake yet could not equivocate to heaven. O, come in,",,,,
736,"equivocator. Knock, knock, knock! Who’s",,,,
737,"there? Faith, here’s an English tailor come hither for",,,,
738,"stealing out of a French hose. Come in, tailor. Here",,,,
739,"you may roast your goose. Knock, knock!",,,,
740,Never at quiet.—What are you?—But this place is,,,,
741,too cold for hell. I’ll devil-porter it no further. I had,,,,
742,thought to have let in some of all professions that go,,,,
743,the primrose way to th’ everlasting bonfire.,,,,
744,"Anon, anon!",,,,
745,"I pray you, remember the porter.",,,,
746,"Was it so late, friend, ere you went to bed",,,,
747,That you do lie so late?,,,,
748,"Faith, sir, we were carousing till the second",,,,
749,"cock, and drink, sir, is a great provoker of three",,,,
750,things.,,,,
751,What three things does drink especially,,,,
752,provoke?,,,,
753,"Marry, sir, nose-painting, sleep, and urine.",,,,
754,"Lechery, sir, it provokes and unprovokes. It provokes",,,,
755,"the desire, but it takes away the performance.",,,,
756,Therefore much drink may be said to be an,,,,
757,"equivocator with lechery. It makes him, and it",,,,
758,"mars him; it sets him on, and it takes him off; it",,,,
759,persuades him and disheartens him; makes him,,,,
760,"stand to and not stand to; in conclusion, equivocates",,,,
761,"him in a sleep and, giving him the lie, leaves",,,,
762,him.,,,,
763,I believe drink gave thee the lie last night.,,,,
764,"That it did, sir, i’ th’ very throat on me; but I",,,,
765,"requited him for his lie, and, I think, being too",,,,
766,"strong for him, though he took up my legs sometime,",,,,
767,yet I made a shift to cast him.,,,,
768,Is thy master stirring?,,,,
769,Our knocking has awaked him. Here he comes.,,,,
770,"Good morrow, noble sir.",,,,
771,"Good morrow, both.",,,,
772,"Is the King stirring, worthy thane?",,,,
773,Not yet.,,,,
774,He did command me to call timely on him.,,,,
775,I have almost slipped the hour.,,,,
776,I’ll bring you to him.,,,,
777,"I know this is a joyful trouble to you,",,,,
778,But yet ’tis one.,,,,
779,The labor we delight in physics pain.,,,,
780,This is the door.,,,,
781,"I’ll make so bold to call,",,,,
782,For ’tis my limited service.,,,,
783,Goes the King hence today?,,,,
784,He does. He did appoint so.,,,,
785,"The night has been unruly. Where we lay,",,,,
786,"Our chimneys were blown down and, as they say,",,,,
787,"Lamentings heard i’ th’ air, strange screams of",,,,
788,"death,",,,,
789,"And prophesying, with accents terrible,",,,,
790,Of dire combustion and confused events,,,,
791,New hatched to th’ woeful time. The obscure bird,,,,
792,Clamored the livelong night. Some say the Earth,,,,
793,Was feverous and did shake.,,,,
794,’Twas a rough night.,,,,
795,My young remembrance cannot parallel,,,,
796,A fellow to it.,,,,
797,"O horror, horror, horror!",,,,
798,Tongue nor heart cannot conceive nor name thee!,,,,
799,What’s the matter?,,,,
800,Confusion now hath made his masterpiece.,,,,
801,Most sacrilegious murder hath broke ope,,,,
802,The Lord’s anointed temple and stole thence,,,,
803,The life o’ th’ building.,,,,
804,What is ’t you say? The life?,,,,
805,Mean you his Majesty?,,,,
806,Approach the chamber and destroy your sight,,,,
807,With a new Gorgon. Do not bid me speak.,,,,
808,See and then speak yourselves.,,,,
809,"Awake, awake!",,,,
810,Ring the alarum bell.—Murder and treason!,,,,
811,"Banquo and Donalbain, Malcolm, awake!",,,,
812,"Shake off this downy sleep, death’s counterfeit,",,,,
813,"And look on death itself. Up, up, and see",,,,
814,"The great doom’s image. Malcolm, Banquo,",,,,
815,As from your graves rise up and walk like sprites,,,,
816,To countenance this horror.—Ring the bell.,,,,
817,"What’s the business,",,,,
818,That such a hideous trumpet calls to parley,,,,
819,"The sleepers of the house? Speak, speak!",,,,
820,"O gentle lady,",,,,
821,’Tis not for you to hear what I can speak.,,,,
822,The repetition in a woman’s ear,,,,
823,Would murder as it fell.,,,,
824,"O Banquo, Banquo,",,,,
825,Our royal master’s murdered.,,,,
826,"Woe, alas!",,,,
827,"What, in our house?",,,,
828,Too cruel anywhere.—,,,,
829,"Dear Duff, I prithee, contradict thyself",,,,
830,And say it is not so.,,,,
831,"Had I but died an hour before this chance,",,,,
832,I had lived a blessèd time; for from this instant,,,,
833,There’s nothing serious in mortality.,,,,
834,All is but toys. Renown and grace is dead.,,,,
835,"The wine of life is drawn, and the mere lees",,,,
836,Is left this vault to brag of.,,,,
837,What is amiss?,,,,
838,"You are, and do not know ’t.",,,,
839,"The spring, the head, the fountain of your blood",,,,
840,Is stopped; the very source of it is stopped.,,,,
841,Your royal father’s murdered.,,,,
842,"O, by whom?",,,,
843,"Those of his chamber, as it seemed, had done ’t.",,,,
844,Their hands and faces were all badged with blood.,,,,
845,"So were their daggers, which unwiped we found",,,,
846,Upon their pillows. They stared and were distracted.,,,,
847,No man’s life was to be trusted with them.,,,,
848,"O, yet I do repent me of my fury,",,,,
849,That I did kill them.,,,,
850,Wherefore did you so?,,,,
851,"Who can be wise, amazed, temp’rate, and furious,",,,,
852,"Loyal, and neutral, in a moment? No man.",,,,
853,Th’ expedition of my violent love,,,,
854,"Outrun the pauser, reason. Here lay Duncan,",,,,
855,"His silver skin laced with his golden blood,",,,,
856,And his gashed stabs looked like a breach in nature,,,,
857,"For ruin’s wasteful entrance; there the murderers,",,,,
858,"Steeped in the colors of their trade, their daggers",,,,
859,Unmannerly breeched with gore. Who could refrain,,,,
860,"That had a heart to love, and in that heart",,,,
861,Courage to make ’s love known?,,,,
862,"Help me hence, ho!",,,,
863,Look to the lady.,,,,
864,Why do we hold our,,,,
865,"tongues,",,,,
866,That most may claim this argument for ours?,,,,
867,"What should be spoken here, where our fate,",,,,
868,"Hid in an auger hole, may rush and seize us?",,,,
869,Let’s away. Our tears are not yet brewed.,,,,
870,Nor our strong sorrow upon the foot of motion.,,,,
871,Look to the lady.,,,,
872,"And when we have our naked frailties hid,",,,,
873,"That suffer in exposure, let us meet",,,,
874,And question this most bloody piece of work,,,,
875,To know it further. Fears and scruples shake us.,,,,
876,"In the great hand of God I stand, and thence",,,,
877,Against the undivulged pretense I fight,,,,
878,Of treasonous malice.,,,,
879,And so do I.,,,,
880,So all.,,,,
881,Let’s briefly put on manly readiness,,,,
882,And meet i’ th’ hall together.,,,,
883,Well contented.,,,,
884,What will you do? Let’s not consort with them.,,,,
885,To show an unfelt sorrow is an office,,,,
886,Which the false man does easy. I’ll to England.,,,,
887,To Ireland I. Our separated fortune,,,,
888,"Shall keep us both the safer. Where we are,",,,,
889,"There’s daggers in men’s smiles. The near in blood,",,,,
890,The nearer bloody.,,,,
891,This murderous shaft that’s shot,,,,
892,"Hath not yet lighted, and our safest way",,,,
893,"Is to avoid the aim. Therefore to horse,",,,,
894,And let us not be dainty of leave-taking,,,,
895,But shift away. There’s warrant in that theft,,,,
896,Which steals itself when there’s no mercy left.,,,,
897,"Threescore and ten I can remember well,",,,,
898,Within the volume of which time I have seen,,,,
899,"Hours dreadful and things strange, but this sore",,,,
900,night,,,,
901,Hath trifled former knowings.,,,,
902,"Ha, good father,",,,,
903,"Thou seest the heavens, as troubled with man’s act,",,,,
904,"Threatens his bloody stage. By th’ clock ’tis day,",,,,
905,And yet dark night strangles the traveling lamp.,,,,
906,Is ’t night’s predominance or the day’s shame,,,,
907,That darkness does the face of earth entomb,,,,
908,When living light should kiss it?,,,,
909,"’Tis unnatural,",,,,
910,Even like the deed that’s done. On Tuesday last,,,,
911,"A falcon, tow’ring in her pride of place,",,,,
912,Was by a mousing owl hawked at and killed.,,,,
913,And Duncan’s horses (a thing most strange and,,,,
914,"certain),",,,,
915,"Beauteous and swift, the minions of their race,",,,,
916,"Turned wild in nature, broke their stalls, flung out,",,,,
917,"Contending ’gainst obedience, as they would",,,,
918,Make war with mankind.,,,,
919,’Tis said they eat each,,,,
920,other.,,,,
921,"They did so, to th’ amazement of mine eyes",,,,
922,That looked upon ’t.,,,,
923,Here comes the good,,,,
924,Macduff.—,,,,
925,"How goes the world, sir, now?",,,,
926,"Why, see you not?",,,,
927,Is ’t known who did this more than bloody deed?,,,,
928,Those that Macbeth hath slain.,,,,
929,"Alas the day,",,,,
930,What good could they pretend?,,,,
931,They were suborned.,,,,
932,"Malcolm and Donalbain, the King’s two sons,",,,,
933,"Are stol’n away and fled, which puts upon them",,,,
934,Suspicion of the deed.,,,,
935,’Gainst nature still!,,,,
936,"Thriftless ambition, that will ravin up",,,,
937,Thine own lives’ means. Then ’tis most like,,,,
938,The sovereignty will fall upon Macbeth.,,,,
939,He is already named and gone to Scone,,,,
940,To be invested.,,,,
941,Where is Duncan’s body?,,,,
942,"Carried to Colmekill,",,,,
943,The sacred storehouse of his predecessors,,,,
944,And guardian of their bones.,,,,
945,Will you to Scone?,,,,
946,"No, cousin, I’ll to Fife.",,,,
947,"Well, I will thither.",,,,
948,"Well, may you see things well done there. Adieu,",,,,
949,Lest our old robes sit easier than our new.,,,,
950,"Farewell, father.",,,,
951,God’s benison go with you and with those,,,,
952,That would make good of bad and friends of foes.,,,,
953,"Thou hast it now—king, Cawdor, Glamis, all",,,,
954,"As the Weïrd Women promised, and I fear",,,,
955,Thou played’st most foully for ’t. Yet it was said,,,,
956,"It should not stand in thy posterity,",,,,
957,But that myself should be the root and father,,,,
958,Of many kings. If there come truth from them,,,,
959,"(As upon thee, Macbeth, their speeches shine)",,,,
960,"Why, by the verities on thee made good,",,,,
961,"May they not be my oracles as well,",,,,
962,"And set me up in hope? But hush, no more.",,,,
963,Here’s our chief guest.,,,,
964,"If he had been forgotten,",,,,
965,It had been as a gap in our great feast,,,,
966,And all-thing unbecoming.,,,,
967,"Tonight we hold a solemn supper, sir,",,,,
968,And I’ll request your presence.,,,,
969,Let your Highness,,,,
970,"Command upon me, to the which my duties",,,,
971,Are with a most indissoluble tie,,,,
972,Forever knit.,,,,
973,Ride you this afternoon?,,,,
974,"Ay, my good lord.",,,,
975,We should have else desired your good advice,,,,
976,(Which still hath been both grave and prosperous),,,,
977,"In this day’s council, but we’ll take tomorrow.",,,,
978,Is ’t far you ride?,,,,
979,"As far, my lord, as will fill up the time",,,,
980,"’Twixt this and supper. Go not my horse the better,",,,,
981,I must become a borrower of the night,,,,
982,For a dark hour or twain.,,,,
983,Fail not our feast.,,,,
984,"My lord, I will not.",,,,
985,We hear our bloody cousins are bestowed,,,,
986,"In England and in Ireland, not confessing",,,,
987,"Their cruel parricide, filling their hearers",,,,
988,"With strange invention. But of that tomorrow,",,,,
989,When therewithal we shall have cause of state,,,,
990,"Craving us jointly. Hie you to horse. Adieu,",,,,
991,Till you return at night. Goes Fleance with you?,,,,
992,"Ay, my good lord. Our time does call upon ’s.",,,,
993,"I wish your horses swift and sure of foot,",,,,
994,And so I do commend you to their backs.,,,,
995,Farewell.,,,,
996,Let every man be master of his time,,,,
997,Till seven at night. To make society,,,,
998,"The sweeter welcome, we will keep ourself",,,,
999,"Till suppertime alone. While then, God be with you.",,,,
1000,"Sirrah, a word with you. Attend those men",,,,
1001,Our pleasure?,,,,
1002,"They are, my lord, without the palace gate.",,,,
1003,Bring them before us.,,,,
1004,"To be thus is nothing,",,,,
1005,But to be safely thus. Our fears in Banquo,,,,
1006,"Stick deep, and in his royalty of nature",,,,
1007,Reigns that which would be feared. ’Tis much he,,,,
1008,"dares,",,,,
1009,And to that dauntless temper of his mind,,,,
1010,He hath a wisdom that doth guide his valor,,,,
1011,To act in safety. There is none but he,,,,
1012,Whose being I do fear; and under him,,,,
1013,"My genius is rebuked, as it is said",,,,
1014,Mark Antony’s was by Caesar. He chid the sisters,,,,
1015,When first they put the name of king upon me,,,,
1016,"And bade them speak to him. Then, prophet-like,",,,,
1017,They hailed him father to a line of kings.,,,,
1018,Upon my head they placed a fruitless crown,,,,
1019,"And put a barren scepter in my grip,",,,,
1020,"Thence to be wrenched with an unlineal hand,",,,,
1021,"No son of mine succeeding. If ’t be so,",,,,
1022,For Banquo’s issue have I filed my mind;,,,,
1023,"For them the gracious Duncan have I murdered,",,,,
1024,Put rancors in the vessel of my peace,,,,
1025,"Only for them, and mine eternal jewel",,,,
1026,Given to the common enemy of man,,,,
1027,"To make them kings, the seeds of Banquo kings.",,,,
1028,"Rather than so, come fate into the list,",,,,
1029,And champion me to th’ utterance.—Who’s there?,,,,
1030,"Now go to the door, and stay there",,,,
1031,till we call.,,,,
1032,Was it not yesterday we spoke together?,,,,
1033,"It was, so please your Highness.",,,,
1034,"Well then, now",,,,
1035,Have you considered of my speeches? Know,,,,
1036,"That it was he, in the times past, which held you",,,,
1037,"So under fortune, which you thought had been",,,,
1038,Our innocent self. This I made good to you,,,,
1039,"In our last conference, passed in probation with you",,,,
1040,"How you were borne in hand, how crossed, the",,,,
1041,"instruments,",,,,
1042,"Who wrought with them, and all things else that",,,,
1043,might,,,,
1044,To half a soul and to a notion crazed,,,,
1045,Say Thus did Banquo.,,,,
1046,You made it known to us.,,,,
1047,"I did so, and went further, which is now",,,,
1048,Our point of second meeting. Do you find,,,,
1049,Your patience so predominant in your nature,,,,
1050,That you can let this go? Are you so gospeled,,,,
1051,"To pray for this good man and for his issue,",,,,
1052,Whose heavy hand hath bowed you to the grave,,,,
1053,And beggared yours forever?,,,,
1054,"We are men, my liege.",,,,
1055,"Ay, in the catalogue you go for men,",,,,
1056,"As hounds and greyhounds, mongrels, spaniels,",,,,
1057,"curs,",,,,
1058,"Shoughs, water-rugs, and demi-wolves are clept",,,,
1059,All by the name of dogs. The valued file,,,,
1060,"Distinguishes the swift, the slow, the subtle,",,,,
1061,"The housekeeper, the hunter, every one",,,,
1062,According to the gift which bounteous nature,,,,
1063,Hath in him closed; whereby he does receive,,,,
1064,"Particular addition, from the bill",,,,
1065,That writes them all alike. And so of men.,,,,
1066,"Now, if you have a station in the file,",,,,
1067,"Not i’ th’ worst rank of manhood, say ’t,",,,,
1068,And I will put that business in your bosoms,,,,
1069,"Whose execution takes your enemy off,",,,,
1070,"Grapples you to the heart and love of us,",,,,
1071,"Who wear our health but sickly in his life,",,,,
1072,Which in his death were perfect.,,,,
1073,"I am one, my liege,",,,,
1074,Whom the vile blows and buffets of the world,,,,
1075,Hath so incensed that I am reckless what,,,,
1076,I do to spite the world.,,,,
1077,And I another,,,,
1078,"So weary with disasters, tugged with fortune,",,,,
1079,"That I would set my life on any chance,",,,,
1080,To mend it or be rid on ’t.,,,,
1081,Both of you,,,,
1082,Know Banquo was your enemy.,,,,
1083,"True, my lord.",,,,
1084,"So is he mine, and in such bloody distance",,,,
1085,That every minute of his being thrusts,,,,
1086,Against my near’st of life. And though I could,,,,
1087,With barefaced power sweep him from my sight,,,,
1088,"And bid my will avouch it, yet I must not,",,,,
1089,"For certain friends that are both his and mine,",,,,
1090,"Whose loves I may not drop, but wail his fall",,,,
1091,Who I myself struck down. And thence it is,,,,
1092,"That I to your assistance do make love,",,,,
1093,Masking the business from the common eye,,,,
1094,For sundry weighty reasons.,,,,
1095,"We shall, my lord,",,,,
1096,Perform what you command us.,,,,
1097,Though our lives—,,,,
1098,Your spirits shine through you. Within this hour at,,,,
1099,most,,,,
1100,"I will advise you where to plant yourselves,",,,,
1101,"Acquaint you with the perfect spy o’ th’ time,",,,,
1102,"The moment on ’t, for ’t must be done tonight",,,,
1103,And something from the palace; always thought,,,,
1104,That I require a clearness. And with him,,,,
1105,(To leave no rubs nor botches in the work),,,,
1106,"Fleance, his son, that keeps him company,",,,,
1107,Whose absence is no less material to me,,,,
1108,"Than is his father’s, must embrace the fate",,,,
1109,Of that dark hour. Resolve yourselves apart.,,,,
1110,I’ll come to you anon.,,,,
1111,"We are resolved, my lord.",,,,
1112,I’ll call upon you straight. Abide within.,,,,
1113,"It is concluded. Banquo, thy soul’s flight,",,,,
1114,"If it find heaven, must find it out tonight.",,,,
1115,Is Banquo gone from court?,,,,
1116,"Ay, madam, but returns again tonight.",,,,
1117,Say to the King I would attend his leisure,,,,
1118,For a few words.,,,,
1119,"Madam, I will.",,,,
1120,"Naught’s had, all’s spent,",,,,
1121,Where our desire is got without content.,,,,
1122,’Tis safer to be that which we destroy,,,,
1123,Than by destruction dwell in doubtful joy.,,,,
1124,"How now, my lord, why do you keep alone,",,,,
1125,"Of sorriest fancies your companions making,",,,,
1126,Using those thoughts which should indeed have died,,,,
1127,With them they think on? Things without all remedy,,,,
1128,Should be without regard. What’s done is done.,,,,
1129,"We have scorched the snake, not killed it.",,,,
1130,She’ll close and be herself whilst our poor malice,,,,
1131,Remains in danger of her former tooth.,,,,
1132,"But let the frame of things disjoint, both the worlds",,,,
1133,"suffer,",,,,
1134,"Ere we will eat our meal in fear, and sleep",,,,
1135,In the affliction of these terrible dreams,,,,
1136,"That shake us nightly. Better be with the dead,",,,,
