line_idx,text,,,,
1137,"Whom we, to gain our peace, have sent to peace,",,,,
1138,Than on the torture of the mind to lie,,,,
1139,In restless ecstasy. Duncan is in his grave.,,,,
1140,After life’s fitful fever he sleeps well.,,,,
1141,"Treason has done his worst; nor steel nor poison,",,,,
1142,"Malice domestic, foreign levy, nothing",,,,
1143,Can touch him further.,,,,
1144,"Come on, gentle my lord,",,,,
1145,Sleek o’er your rugged looks. Be bright and jovial,,,,
1146,Among your guests tonight.,,,,
1147,"So shall I, love,",,,,
1148,And so I pray be you. Let your remembrance,,,,
1149,Apply to Banquo; present him eminence,,,,
1150,Both with eye and tongue: unsafe the while that we,,,,
1151,Must lave our honors in these flattering streams,,,,
1152,"And make our faces vizards to our hearts,",,,,
1153,Disguising what they are.,,,,
1154,You must leave this.,,,,
1155,"O, full of scorpions is my mind, dear wife!",,,,
1156,Thou know’st that Banquo and his Fleance lives.,,,,
1157,But in them nature’s copy’s not eterne.,,,,
1158,There’s comfort yet; they are assailable.,,,,
1159,Then be thou jocund. Ere the bat hath flown,,,,
1160,"His cloistered flight, ere to black Hecate’s summons",,,,
1161,The shard-born beetle with his drowsy hums,,,,
1162,"Hath rung night’s yawning peal, there shall be done",,,,
1163,A deed of dreadful note.,,,,
1164,What’s to be done?,,,,
1165,"Be innocent of the knowledge, dearest chuck,",,,,
1166,"Till thou applaud the deed.—Come, seeling night,",,,,
1167,Scarf up the tender eye of pitiful day,,,,
1168,And with thy bloody and invisible hand,,,,
1169,Cancel and tear to pieces that great bond,,,,
1170,"Which keeps me pale. Light thickens, and the crow",,,,
1171,Makes wing to th’ rooky wood.,,,,
1172,"Good things of day begin to droop and drowse,",,,,
1173,Whiles night’s black agents to their preys do,,,,
1174,rouse.—,,,,
1175,"Thou marvel’st at my words, but hold thee still.",,,,
1176,Things bad begun make strong themselves by ill.,,,,
1177,So prithee go with me.,,,,
1178,But who did bid thee join with us?,,,,
1179,Macbeth.,,,,
1180,"He needs not our mistrust, since he delivers",,,,
1181,Our offices and what we have to do,,,,
1182,To the direction just.,,,,
1183,Then stand with us.—,,,,
1184,The west yet glimmers with some streaks of day.,,,,
1185,Now spurs the lated traveler apace,,,,
1186,"To gain the timely inn, and near approaches",,,,
1187,The subject of our watch.,,,,
1188,"Hark, I hear horses.",,,,
1189,"Give us a light there, ho!",,,,
1190,Then ’tis he. The rest,,,,
1191,That are within the note of expectation,,,,
1192,Already are i’ th’ court.,,,,
1193,His horses go about.,,,,
1194,Almost a mile; but he does usually,,,,
1195,(So all men do) from hence to th’ palace gate,,,,
1196,Make it their walk.,,,,
1197,"A light, a light!",,,,
1198,’Tis he.,,,,
1199,Stand to ’t.,,,,
1200,It will be rain tonight.,,,,
1201,Let it come down!,,,,
1202,"O treachery! Fly, good Fleance, fly, fly, fly!",,,,
1203,Thou mayst revenge—O slave!,,,,
1204,Who did strike out the light?,,,,
1205,Was ’t not the way?,,,,
1206,There’s but one down. The son is,,,,
1207,fled.,,,,
1208,We have lost best half of our,,,,
1209,affair.,,,,
1210,"Well, let’s away and say how much is done.",,,,
1211,You know your own degrees; sit down. At first,,,,
1212,"And last, the hearty welcome.",,,,
1213,Thanks to your Majesty.,,,,
1214,Ourself will mingle with society,,,,
1215,And play the humble host.,,,,
1216,"Our hostess keeps her state, but in best time",,,,
1217,We will require her welcome.,,,,
1218,"Pronounce it for me, sir, to all our friends,",,,,
1219,For my heart speaks they are welcome.,,,,
1220,"See, they encounter thee with their hearts’ thanks.",,,,
1221,Both sides are even. Here I’ll sit i’ th’ midst.,,,,
1222,Be large in mirth. Anon we’ll drink a measure,,,,
1223,The table round. There’s,,,,
1224,blood upon thy face.,,,,
1225,’Tis Banquo’s then.,,,,
1226,’Tis better thee without than he within.,,,,
1227,Is he dispatched?,,,,
1228,"My lord, his throat is cut. That I did for him.",,,,
1229,"Thou art the best o’ th’ cutthroats,",,,,
1230,Yet he’s good that did the like for Fleance.,,,,
1231,"If thou didst it, thou art the nonpareil.",,,,
1232,"Most royal sir, Fleance is ’scaped.",,,,
1233,"Then comes my fit again. I had else been perfect,",,,,
1234,"Whole as the marble, founded as the rock,",,,,
1235,As broad and general as the casing air.,,,,
1236,"But now I am cabined, cribbed, confined, bound in",,,,
1237,To saucy doubts and fears.—But Banquo’s safe?,,,,
1238,"Ay, my good lord. Safe in a ditch he bides,",,,,
1239,"With twenty trenchèd gashes on his head,",,,,
1240,The least a death to nature.,,,,
1241,Thanks for that.,,,,
1242,There the grown serpent lies. The worm that’s fled,,,,
1243,"Hath nature that in time will venom breed,",,,,
1244,No teeth for th’ present. Get thee gone. Tomorrow,,,,
1245,We’ll hear ourselves again.,,,,
1246,"My royal lord,",,,,
1247,You do not give the cheer. The feast is sold,,,,
1248,"That is not often vouched, while ’tis a-making,",,,,
1249,’Tis given with welcome. To feed were best at home;,,,,
1250,"From thence, the sauce to meat is ceremony;",,,,
1251,Meeting were bare without it.,,,,
1252,Sweet remembrancer!—,,,,
1253,"Now, good digestion wait on appetite",,,,
1254,And health on both!,,,,
1255,May ’t please your Highness sit.,,,,
1256,"Here had we now our country’s honor roofed,",,,,
1257,"Were the graced person of our Banquo present,",,,,
1258,Who may I rather challenge for unkindness,,,,
1259,Than pity for mischance.,,,,
1260,"His absence, sir,",,,,
1261,Lays blame upon his promise. Please ’t your,,,,
1262,Highness,,,,
1263,To grace us with your royal company?,,,,
1264,The table’s full.,,,,
1265,"Here is a place reserved, sir.",,,,
1266,Where?,,,,
1267,"Here, my good lord. What is ’t that moves your",,,,
1268,Highness?,,,,
1269,Which of you have done this?,,,,
1270,"What, my good lord?",,,,
1271,Thou canst not say I did it. Never shake,,,,
1272,Thy gory locks at me.,,,,
1273,"Gentlemen, rise. His Highness is not well.",,,,
1274,"Sit, worthy friends. My lord is often thus",,,,
1275,"And hath been from his youth. Pray you, keep seat.",,,,
1276,The fit is momentary; upon a thought,,,,
1277,He will again be well. If much you note him,,,,
1278,You shall offend him and extend his passion.,,,,
1279,Feed and regard him not.,,,,
1280,Are you a man?,,,,
1281,"Ay, and a bold one, that dare look on that",,,,
1282,Which might appall the devil.,,,,
1283,"O, proper stuff!",,,,
1284,This is the very painting of your fear.,,,,
1285,This is the air-drawn dagger which you said,,,,
1286,"Led you to Duncan. O, these flaws and starts,",,,,
1287,"Impostors to true fear, would well become",,,,
1288,"A woman’s story at a winter’s fire,",,,,
1289,Authorized by her grandam. Shame itself!,,,,
1290,"Why do you make such faces? When all’s done,",,,,
1291,You look but on a stool.,,,,
1292,"Prithee, see there. Behold, look! Lo,",,,,
1293,how say you?,,,,
1294,"Why, what care I? If thou canst nod, speak too.—",,,,
1295,If charnel houses and our graves must send,,,,
1296,"Those that we bury back, our monuments",,,,
1297,Shall be the maws of kites.,,,,
1298,"What, quite unmanned in folly?",,,,
1299,"If I stand here, I saw him.",,,,
1300,"Fie, for shame!",,,,
1301,"Blood hath been shed ere now, i’ th’ olden time,",,,,
1302,Ere humane statute purged the gentle weal;,,,,
1303,"Ay, and since too, murders have been performed",,,,
1304,Too terrible for the ear. The time has been,,,,
1305,"That, when the brains were out, the man would die,",,,,
1306,And there an end. But now they rise again,,,,
1307,With twenty mortal murders on their crowns,,,,
1308,And push us from our stools. This is more strange,,,,
1309,Than such a murder is.,,,,
1310,"My worthy lord,",,,,
1311,Your noble friends do lack you.,,,,
1312,I do forget.—,,,,
1313,"Do not muse at me, my most worthy friends.",,,,
1314,"I have a strange infirmity, which is nothing",,,,
1315,"To those that know me. Come, love and health to",,,,
1316,all.,,,,
1317,Then I’ll sit down.—Give me some wine. Fill full.,,,,
1318,I drink to th’ general joy o’ th’ whole table,,,,
1319,"And to our dear friend Banquo, whom we miss.",,,,
1320,"Would he were here! To all, and him we thirst,",,,,
1321,And all to all.,,,,
1322,"Our duties, and the pledge.",,,,
1323,"Avaunt, and quit my sight! Let the earth hide thee.",,,,
1324,Thy bones are marrowless; thy blood is cold;,,,,
1325,Thou hast no speculation in those eyes,,,,
1326,Which thou dost glare with.,,,,
1327,"Think of this, good",,,,
1328,"peers,",,,,
1329,But as a thing of custom. ’Tis no other;,,,,
1330,Only it spoils the pleasure of the time.,,,,
1331,"What man dare, I dare.",,,,
1332,"Approach thou like the rugged Russian bear,",,,,
1333,"The armed rhinoceros, or th’ Hyrcan tiger;",,,,
1334,"Take any shape but that, and my firm nerves",,,,
1335,Shall never tremble. Or be alive again,,,,
1336,And dare me to the desert with thy sword.,,,,
1337,"If trembling I inhabit then, protest me",,,,
1338,"The baby of a girl. Hence, horrible shadow!",,,,
1339,"Unreal mock’ry, hence!",,,,
1340,"Why so, being gone,",,,,
1341,I am a man again.—Pray you sit still.,,,,
1342,"You have displaced the mirth, broke the good",,,,
1343,meeting,,,,
1344,With most admired disorder.,,,,
1345,Can such things be,,,,
1346,"And overcome us like a summer’s cloud,",,,,
1347,Without our special wonder? You make me strange,,,,
1348,Even to the disposition that I owe,,,,
1349,When now I think you can behold such sights,,,,
1350,And keep the natural ruby of your cheeks,,,,
1351,When mine is blanched with fear.,,,,
1352,"What sights, my",,,,
1353,lord?,,,,
1354,"I pray you, speak not. He grows worse and worse.",,,,
1355,"Question enrages him. At once, good night.",,,,
1356,"Stand not upon the order of your going,",,,,
1357,But go at once.,,,,
1358,"Good night, and better health",,,,
1359,Attend his Majesty.,,,,
1360,A kind good night to all.,,,,
1361,"It will have blood, they say; blood will have blood.",,,,
1362,"Stones have been known to move, and trees to",,,,
1363,speak.,,,,
1364,Augurs and understood relations have,,,,
1365,By maggot pies and choughs and rooks brought,,,,
1366,forth,,,,
1367,The secret’st man of blood.—What is the night?,,,,
1368,"Almost at odds with morning, which is which.",,,,
1369,How say’st thou that Macduff denies his person,,,,
1370,At our great bidding?,,,,
1371,"Did you send to him, sir?",,,,
1372,I hear it by the way; but I will send.,,,,
1373,There’s not a one of them but in his house,,,,
1374,I keep a servant fee’d. I will tomorrow,,,,
1375,(And betimes I will) to the Weïrd Sisters.,,,,
1376,"More shall they speak, for now I am bent to know",,,,
1377,"By the worst means the worst. For mine own good,",,,,
1378,All causes shall give way. I am in blood,,,,
1379,"Stepped in so far that, should I wade no more,",,,,
1380,Returning were as tedious as go o’er.,,,,
1381,"Strange things I have in head that will to hand,",,,,
1382,Which must be acted ere they may be scanned.,,,,
1383,"You lack the season of all natures, sleep.",,,,
1384,"Come, we’ll to sleep. My strange and self-abuse",,,,
1385,Is the initiate fear that wants hard use.,,,,
1386,We are yet but young in deed.,,,,
1387,"Why, how now, Hecate? You look angerly.",,,,
1388,"Have I not reason, beldams as you are?",,,,
1389,"Saucy and overbold, how did you dare",,,,
1390,To trade and traffic with Macbeth,,,,
1391,"In riddles and affairs of death,",,,,
1392,"And I, the mistress of your charms,",,,,
1393,"The close contriver of all harms,",,,,
1394,Was never called to bear my part,,,,
1395,Or show the glory of our art?,,,,
1396,"And which is worse, all you have done",,,,
1397,"Hath been but for a wayward son,",,,,
1398,"Spiteful and wrathful, who, as others do,",,,,
1399,"Loves for his own ends, not for you.",,,,
1400,"But make amends now. Get you gone,",,,,
1401,And at the pit of Acheron,,,,
1402,Meet me i’ th’ morning. Thither he,,,,
1403,Will come to know his destiny.,,,,
1404,"Your vessels and your spells provide,",,,,
1405,Your charms and everything beside.,,,,
1406,I am for th’ air. This night I’ll spend,,,,
1407,Unto a dismal and a fatal end.,,,,
1408,Great business must be wrought ere noon.,,,,
1409,Upon the corner of the moon,,,,
1410,There hangs a vap’rous drop profound.,,,,
1411,"I’ll catch it ere it come to ground,",,,,
1412,"And that, distilled by magic sleights,",,,,
1413,Shall raise such artificial sprites,,,,
1414,As by the strength of their illusion,,,,
1415,Shall draw him on to his confusion.,,,,
1416,"He shall spurn fate, scorn death, and bear",,,,
1417,"His hopes ’bove wisdom, grace, and fear.",,,,
1418,"And you all know, security",,,,
1419,Is mortals’ chiefest enemy.,,,,
1420,"Hark! I am called. My little spirit, see,",,,,
1421,Sits in a foggy cloud and stays for me.,,,,
1422,"Come, let’s make haste. She’ll soon be back again.",,,,
1423,"My former speeches have but hit your thoughts,",,,,
1424,Which can interpret farther. Only I say,,,,
1425,Things have been strangely borne. The gracious,,,,
1426,Duncan,,,,
1427,"Was pitied of Macbeth; marry, he was dead.",,,,
1428,"And the right valiant Banquo walked too late,",,,,
1429,"Whom you may say, if ’t please you, Fleance killed,",,,,
1430,For Fleance fled. Men must not walk too late.,,,,
1431,Who cannot want the thought how monstrous,,,,
1432,It was for Malcolm and for Donalbain,,,,
1433,"To kill their gracious father? Damnèd fact,",,,,
1434,How it did grieve Macbeth! Did he not straight,,,,
1435,In pious rage the two delinquents tear,,,,
1436,That were the slaves of drink and thralls of sleep?,,,,
1437,"Was not that nobly done? Ay, and wisely, too,",,,,
1438,For ’twould have angered any heart alive,,,,
1439,To hear the men deny ’t. So that I say,,,,
1440,He has borne all things well. And I do think,,,,
1441,That had he Duncan’s sons under his key,,,,
1442,"(As, an ’t please heaven, he shall not) they should",,,,
1443,find,,,,
1444,What ’twere to kill a father. So should Fleance.,,,,
1445,"But peace. For from broad words, and ’cause he",,,,
1446,failed,,,,
1447,"His presence at the tyrant’s feast, I hear",,,,
1448,"Macduff lives in disgrace. Sir, can you tell",,,,
1449,Where he bestows himself?,,,,
1450,The son of Duncan,,,,
1451,(From whom this tyrant holds the due of birth),,,,
1452,Lives in the English court and is received,,,,
1453,Of the most pious Edward with such grace,,,,
1454,That the malevolence of fortune nothing,,,,
1455,Takes from his high respect. Thither Macduff,,,,
1456,Is gone to pray the holy king upon his aid,,,,
1457,To wake Northumberland and warlike Siward,,,,
1458,"That, by the help of these (with Him above",,,,
1459,"To ratify the work), we may again",,,,
1460,"Give to our tables meat, sleep to our nights,",,,,
1461,"Free from our feasts and banquets bloody knives,",,,,
1462,"Do faithful homage, and receive free honors,",,,,
1463,All which we pine for now. And this report,,,,
1464,Hath so exasperate the King that he,,,,
1465,Prepares for some attempt of war.,,,,
1466,Sent he to Macduff?,,,,
1467,"He did, and with an absolute Sir, not I,",,,,
1468,The cloudy messenger turns me his back,,,,
1469,"And hums, as who should say You’ll rue the time",,,,
1470,That clogs me with this answer.,,,,
1471,And that well might,,,,
1472,Advise him to a caution t’ hold what distance,,,,
1473,His wisdom can provide. Some holy angel,,,,
1474,Fly to the court of England and unfold,,,,
1475,"His message ere he come, that a swift blessing",,,,
1476,May soon return to this our suffering country,,,,
1477,Under a hand accursed.,,,,
1478,I’ll send my prayers with him.,,,,
1479,Thrice the brinded cat hath mewed.,,,,
1480,"Thrice, and once the hedge-pig whined.",,,,
1481,"Harpier cries ’Tis time, ’tis time!",,,,
1482,Round about the cauldron go;,,,,
1483,In the poisoned entrails throw.,,,,
1484,"Toad, that under cold stone",,,,
1485,Days and nights has thirty-one,,,,
1486,"Sweltered venom sleeping got,",,,,
1487,Boil thou first i’ th’ charmèd pot.,,,,
1488,"Double, double toil and trouble;",,,,
1489,"Fire burn, and cauldron bubble.",,,,
1490,Fillet of a fenny snake,,,,
1491,In the cauldron boil and bake.,,,,
1492,"Eye of newt and toe of frog,",,,,
1493,"Wool of bat and tongue of dog,",,,,
1494,"Adder’s fork and blindworm’s sting,",,,,
1495,"Lizard’s leg and howlet’s wing,",,,,
1496,"For a charm of powerful trouble,",,,,
1497,Like a hell-broth boil and bubble.,,,,
1498,"Double, double toil and trouble;",,,,
1499,"Fire burn, and cauldron bubble.",,,,
1500,"Scale of dragon, tooth of wolf,",,,,
1501,"Witch’s mummy, maw and gulf",,,,
1502,"Of the ravined salt-sea shark,",,,,
1503,"Root of hemlock digged i’ th’ dark,",,,,
1504,"Liver of blaspheming Jew,",,,,
1505,Gall of goat and slips of yew,,,,
1506,"Slivered in the moon’s eclipse,",,,,
1507,"Nose of Turk and Tartar’s lips,",,,,
1508,Finger of birth-strangled babe,,,,
1509,"Ditch-delivered by a drab,",,,,
1510,Make the gruel thick and slab.,,,,
1511,Add thereto a tiger’s chaudron,,,,
1512,For th’ ingredience of our cauldron.,,,,
1513,"Double, double toil and trouble;",,,,
1514,"Fire burn, and cauldron bubble.",,,,
1515,Cool it with a baboon’s blood.,,,,
1516,Then the charm is firm and good.,,,,
1517,"O, well done! I commend your pains,",,,,
1518,And everyone shall share i’ th’ gains.,,,,
1519,And now about the cauldron sing,,,,
1520,"Like elves and fairies in a ring,",,,,
1521,Enchanting all that you put in.,,,,
1522,"By the pricking of my thumbs,",,,,
1523,Something wicked this way comes.,,,,
1524,"Open, locks,",,,,
1525,Whoever knocks.,,,,
1526,"How now, you secret, black, and midnight hags?",,,,
1527,What is ’t you do?,,,,
1528,A deed without a name.,,,,
1529,I conjure you by that which you profess,,,,
1530,"(Howe’er you come to know it), answer me.",,,,
1531,Though you untie the winds and let them fight,,,,
1532,"Against the churches, though the yeasty waves",,,,
1533,"Confound and swallow navigation up,",,,,
1534,Though bladed corn be lodged and trees blown,,,,
1535,"down,",,,,
1536,"Though castles topple on their warders’ heads,",,,,
1537,Though palaces and pyramids do slope,,,,
1538,"Their heads to their foundations, though the",,,,
1539,treasure,,,,
1540,Of nature’s germens tumble all together,,,,
1541,"Even till destruction sicken, answer me",,,,
1542,To what I ask you.,,,,
1543,Speak.,,,,
1544,Demand.,,,,
1545,We’ll answer.,,,,
1546,Say if th’ hadst rather hear it from our mouths,,,,
1547,Or from our masters’.,,,,
1548,Call ’em. Let me see ’em.,,,,
1549,Pour in sow’s blood that hath eaten,,,,
1550,Her nine farrow; grease that’s sweaten,,,,
1551,From the murderers’ gibbet throw,,,,
1552,Into the flame.,,,,
1553,Come high or low;,,,,
1554,Thyself and office deftly show.,,,,
1555,"Tell me, thou unknown power—",,,,
1556,He knows thy,,,,
1557,thought.,,,,
1558,Hear his speech but say thou naught.,,,,
1559,Macbeth! Macbeth! Macbeth! Beware Macduff!,,,,
1560,Beware the Thane of Fife! Dismiss me. Enough.,,,,
1561,"Whate’er thou art, for thy good caution, thanks.",,,,
1562,Thou hast harped my fear aright. But one word,,,,
1563,more—,,,,
1564,He will not be commanded. Here’s another,,,,
1565,More potent than the first.,,,,
1566,Macbeth! Macbeth! Macbeth!—,,,,
1567,"Had I three ears, I’d hear thee.",,,,
1568,"Be bloody, bold, and resolute. Laugh to scorn",,,,
1569,"The power of man, for none of woman born",,,,
1570,Shall harm Macbeth.,,,,
1571,"Then live, Macduff; what need I fear of thee?",,,,
1572,But yet I’ll make assurance double sure,,,,
1573,"And take a bond of fate. Thou shalt not live,",,,,
1574,"That I may tell pale-hearted fear it lies,",,,,
1575,And sleep in spite of thunder.,,,,
1576,What is this,,,,
1577,That rises like the issue of a king,,,,
1578,And wears upon his baby brow the round,,,,
1579,And top of sovereignty?,,,,
1580,Listen but speak not to ’t.,,,,
1581,"Be lion-mettled, proud, and take no care",,,,
1582,"Who chafes, who frets, or where conspirers are.",,,,
1583,Macbeth shall never vanquished be until,,,,
1584,Great Birnam Wood to high Dunsinane Hill,,,,
1585,Shall come against him.,,,,
1586,That will never be.,,,,
1587,"Who can impress the forest, bid the tree",,,,
1588,"Unfix his earthbound root? Sweet bodements, good!",,,,
1589,"Rebellious dead, rise never till the Wood",,,,
1590,"Of Birnam rise, and our high-placed Macbeth",,,,
1591,"Shall live the lease of nature, pay his breath",,,,
1592,To time and mortal custom. Yet my heart,,,,
1593,"Throbs to know one thing. Tell me, if your art",,,,
1594,Can tell so much: shall Banquo’s issue ever,,,,
1595,Reign in this kingdom?,,,,
1596,Seek to know no more.,,,,
1597,"I will be satisfied. Deny me this,",,,,
1598,And an eternal curse fall on you! Let me know!,,,,
1599,Why sinks that cauldron? And what noise is this?,,,,
1600,Show.,,,,
1601,Show.,,,,
1602,Show.,,,,
1603,Show his eyes and grieve his heart.,,,,
1604,Come like shadows; so depart.,,,,
1605,Thou art too like the spirit of Banquo. Down!,,,,
1606,"Thy crown does sear mine eyeballs. And thy hair,",,,,
1607,"Thou other gold-bound brow, is like the first.",,,,
1608,"A third is like the former.—Filthy hags,",,,,
1609,"Why do you show me this?—A fourth? Start, eyes!",,,,
1610,"What, will the line stretch out to th’ crack of doom?",,,,
1611,Another yet? A seventh? I’ll see no more.,,,,
1612,And yet the eighth appears who bears a glass,,,,
1613,"Which shows me many more, and some I see",,,,
1614,That twofold balls and treble scepters carry.,,,,
1615,"Horrible sight! Now I see ’tis true,",,,,
1616,For the blood-boltered Banquo smiles upon me,,,,
1617,And points at them for his.,,,,
1618,"What, is this so?",,,,
1619,"Ay, sir, all this is so. But why",,,,
1620,Stands Macbeth thus amazedly?,,,,
1621,"Come, sisters, cheer we up his sprites",,,,
1622,And show the best of our delights.,,,,
1623,I’ll charm the air to give a sound,,,,
1624,"While you perform your antic round,",,,,
1625,That this great king may kindly say,,,,
1626,Our duties did his welcome pay.,,,,
1627,Where are they? Gone? Let this pernicious hour,,,,
1628,Stand aye accursèd in the calendar!—,,,,
1629,"Come in, without there.",,,,
1630,What’s your Grace’s will?,,,,
1631,Saw you the Weïrd Sisters?,,,,
1632,"No, my lord.",,,,
1633,Came they not by you?,,,,
1634,"No, indeed, my lord.",,,,
1635,"Infected be the air whereon they ride,",,,,
1636,And damned all those that trust them! I did hear,,,,
1637,The galloping of horse. Who was ’t came by?,,,,
1638,"’Tis two or three, my lord, that bring you word",,,,
1639,Macduff is fled to England.,,,,
1640,Fled to England?,,,,
1641,"Ay, my good lord.",,,,
1642,"Time, thou anticipat’st my dread exploits.",,,,
1643,The flighty purpose never is o’ertook,,,,
1644,Unless the deed go with it. From this moment,,,,
1645,The very firstlings of my heart shall be,,,,
1646,"The firstlings of my hand. And even now,",,,,
1647,"To crown my thoughts with acts, be it thought and",,,,
1648,done:,,,,
1649,"The castle of Macduff I will surprise,",,,,
1650,"Seize upon Fife, give to th’ edge o’ th’ sword",,,,
1651,"His wife, his babes, and all unfortunate souls",,,,
1652,That trace him in his line. No boasting like a fool;,,,,
1653,This deed I’ll do before this purpose cool.,,,,
1654,But no more sights!—Where are these gentlemen?,,,,
1655,Come bring me where they are.,,,,
1656,What had he done to make him fly the land?,,,,
1657,"You must have patience, madam.",,,,
1658,He had none.,,,,
1659,"His flight was madness. When our actions do not,",,,,
1660,Our fears do make us traitors.,,,,
1661,You know not,,,,
1662,Whether it was his wisdom or his fear.,,,,
1663,"Wisdom? To leave his wife, to leave his babes,",,,,
1664,His mansion and his titles in a place,,,,
1665,From whence himself does fly? He loves us not;,,,,
1666,"He wants the natural touch; for the poor wren,",,,,
1667,"The most diminutive of birds, will fight,",,,,
1668,"Her young ones in her nest, against the owl.",,,,
1669,"All is the fear, and nothing is the love,",,,,
1670,"As little is the wisdom, where the flight",,,,
1671,So runs against all reason.,,,,
1672,"My dearest coz,",,,,
1673,"I pray you school yourself. But for your husband,",,,,
1674,"He is noble, wise, judicious, and best knows",,,,
1675,The fits o’ th’ season. I dare not speak much,,,,
1676,further;,,,,
1677,But cruel are the times when we are traitors,,,,
1678,And do not know ourselves; when we hold rumor,,,,
1679,"From what we fear, yet know not what we fear,",,,,
1680,But float upon a wild and violent sea,,,,
1681,Each way and move—I take my leave of you.,,,,
1682,Shall not be long but I’ll be here again.,,,,
1683,Things at the worst will cease or else climb upward,,,,
1684,"To what they were before.—My pretty cousin,",,,,
1685,Blessing upon you.,,,,
1686,"Fathered he is, and yet he’s fatherless.",,,,
1687,"I am so much a fool, should I stay longer",,,,
1688,It would be my disgrace and your discomfort.,,,,
1689,I take my leave at once.,,,,
1690,"Sirrah, your father’s dead.",,,,
1691,And what will you do now? How will you live?,,,,
1692,"As birds do, mother.",,,,
1693,"What, with worms and flies?",,,,
1694,"With what I get, I mean; and so do they.",,,,
1695,"Poor bird, thou ’dst never fear the net nor lime,",,,,
1696,The pitfall nor the gin.,,,,
1697,"Why should I, mother? Poor birds they are not set",,,,
1698,for.,,,,
1699,"My father is not dead, for all your saying.",,,,
1700,"Yes, he is dead. How wilt thou do for a father?",,,,
1701,"Nay, how will you do for a husband?",,,,
1702,"Why, I can buy me twenty at any market.",,,,
1703,Then you’ll buy ’em to sell again.,,,,
1704,"Thou speak’st with all thy wit,",,,,
