line_idx,text,,,,
1705,"And yet, i’ faith, with wit enough for thee.",,,,
1706,"Was my father a traitor, mother?",,,,
1707,"Ay, that he was.",,,,
1708,What is a traitor?,,,,
1709,"Why, one that swears and lies.",,,,
1710,And be all traitors that do so?,,,,
1711,Every one that does so is a traitor,,,,
1712,and must be hanged.,,,,
1713,And must they all be hanged that swear and lie?,,,,
1714,Every one.,,,,
1715,Who must hang them?,,,,
1716,"Why, the honest men.",,,,
1717,"Then the liars and swearers are fools, for there",,,,
1718,are liars and swearers enough to beat the honest,,,,
1719,men and hang up them.,,,,
1720,"Now God help thee, poor monkey! But",,,,
1721,how wilt thou do for a father?,,,,
1722,"If he were dead, you’d weep for him. If you would",,,,
1723,"not, it were a good sign that I should quickly have a",,,,
1724,new father.,,,,
1725,"Poor prattler, how thou talk’st!",,,,
1726,"Bless you, fair dame. I am not to you known,",,,,
1727,Though in your state of honor I am perfect.,,,,
1728,I doubt some danger does approach you nearly.,,,,
1729,"If you will take a homely man’s advice,",,,,
1730,Be not found here. Hence with your little ones!,,,,
1731,To fright you thus methinks I am too savage;,,,,
1732,"To do worse to you were fell cruelty,",,,,
1733,Which is too nigh your person. Heaven preserve,,,,
1734,you!,,,,
1735,I dare abide no longer.,,,,
1736,Whither should I fly?,,,,
1737,I have done no harm. But I remember now,,,,
1738,"I am in this earthly world, where to do harm",,,,
1739,"Is often laudable, to do good sometime",,,,
1740,"Accounted dangerous folly. Why then, alas,",,,,
1741,Do I put up that womanly defense,,,,
1742,To say I have done no harm?,,,,
1743,What are these faces?,,,,
1744,Where is your husband?,,,,
1745,I hope in no place so unsanctified,,,,
1746,Where such as thou mayst find him.,,,,
1747,He’s a traitor.,,,,
1748,"Thou liest, thou shag-eared villain!",,,,
1749,"What, you egg?",,,,
1750,Young fry of treachery!,,,,
1751,He has killed,,,,
1752,"me, mother.",,,,
1753,"Run away, I pray you.",,,,
1754,Let us seek out some desolate shade and there,,,,
1755,Weep our sad bosoms empty.,,,,
1756,Let us rather,,,,
1757,"Hold fast the mortal sword and, like good men,",,,,
1758,Bestride our downfall’n birthdom. Each new morn,,,,
1759,"New widows howl, new orphans cry, new sorrows",,,,
1760,"Strike heaven on the face, that it resounds",,,,
1761,"As if it felt with Scotland, and yelled out",,,,
1762,Like syllable of dolor.,,,,
1763,"What I believe, I’ll wail;",,,,
1764,"What know, believe; and what I can redress,",,,,
1765,"As I shall find the time to friend, I will.",,,,
1766,"What you have spoke, it may be so, perchance.",,,,
1767,"This tyrant, whose sole name blisters our tongues,",,,,
1768,Was once thought honest. You have loved him well.,,,,
1769,"He hath not touched you yet. I am young, but",,,,
1770,something,,,,
1771,"You may deserve of him through me, and wisdom",,,,
1772,"To offer up a weak, poor, innocent lamb",,,,
1773,T’ appease an angry god.,,,,
1774,I am not treacherous.,,,,
1775,But Macbeth is.,,,,
1776,A good and virtuous nature may recoil,,,,
1777,In an imperial charge. But I shall crave your,,,,
1778,pardon.,,,,
1779,"That which you are, my thoughts cannot transpose.",,,,
1780,"Angels are bright still, though the brightest fell.",,,,
1781,Though all things foul would wear the brows of,,,,
1782,"grace,",,,,
1783,Yet grace must still look so.,,,,
1784,I have lost my hopes.,,,,
1785,Perchance even there where I did find my doubts.,,,,
1786,"Why in that rawness left you wife and child,",,,,
1787,"Those precious motives, those strong knots of love,",,,,
1788,"Without leave-taking? I pray you,",,,,
1789,"Let not my jealousies be your dishonors,",,,,
1790,"But mine own safeties. You may be rightly just,",,,,
1791,Whatever I shall think.,,,,
1792,"Bleed, bleed, poor country!",,,,
1793,"Great tyranny, lay thou thy basis sure,",,,,
1794,For goodness dare not check thee. Wear thou thy,,,,
1795,wrongs;,,,,
1796,"The title is affeered.—Fare thee well, lord.",,,,
1797,I would not be the villain that thou think’st,,,,
1798,"For the whole space that’s in the tyrant’s grasp,",,,,
1799,And the rich East to boot.,,,,
1800,Be not offended.,,,,
1801,I speak not as in absolute fear of you.,,,,
1802,I think our country sinks beneath the yoke.,,,,
1803,"It weeps, it bleeds, and each new day a gash",,,,
1804,Is added to her wounds. I think withal,,,,
1805,There would be hands uplifted in my right;,,,,
1806,And here from gracious England have I offer,,,,
1807,"Of goodly thousands. But, for all this,",,,,
1808,When I shall tread upon the tyrant’s head,,,,
1809,"Or wear it on my sword, yet my poor country",,,,
1810,"Shall have more vices than it had before,",,,,
1811,"More suffer, and more sundry ways than ever,",,,,
1812,By him that shall succeed.,,,,
1813,What should he be?,,,,
1814,"It is myself I mean, in whom I know",,,,
1815,All the particulars of vice so grafted,,,,
1816,"That, when they shall be opened, black Macbeth",,,,
1817,"Will seem as pure as snow, and the poor state",,,,
1818,"Esteem him as a lamb, being compared",,,,
1819,With my confineless harms.,,,,
1820,Not in the legions,,,,
1821,Of horrid hell can come a devil more damned,,,,
1822,In evils to top Macbeth.,,,,
1823,"I grant him bloody,",,,,
1824,"Luxurious, avaricious, false, deceitful,",,,,
1825,"Sudden, malicious, smacking of every sin",,,,
1826,"That has a name. But there’s no bottom, none,",,,,
1827,"In my voluptuousness. Your wives, your daughters,",,,,
1828,"Your matrons, and your maids could not fill up",,,,
1829,"The cistern of my lust, and my desire",,,,
1830,All continent impediments would o’erbear,,,,
1831,That did oppose my will. Better Macbeth,,,,
1832,Than such an one to reign.,,,,
1833,Boundless intemperance,,,,
1834,In nature is a tyranny. It hath been,,,,
1835,Th’ untimely emptying of the happy throne,,,,
1836,And fall of many kings. But fear not yet,,,,
1837,To take upon you what is yours. You may,,,,
1838,Convey your pleasures in a spacious plenty,,,,
1839,And yet seem cold—the time you may so hoodwink.,,,,
1840,We have willing dames enough. There cannot be,,,,
1841,That vulture in you to devour so many,,,,
1842,"As will to greatness dedicate themselves,",,,,
1843,Finding it so inclined.,,,,
1844,With this there grows,,,,
1845,In my most ill-composed affection such,,,,
1846,"A stanchless avarice that, were I king,",,,,
1847,"I should cut off the nobles for their lands,",,,,
1848,"Desire his jewels, and this other’s house;",,,,
1849,And my more-having would be as a sauce,,,,
1850,"To make me hunger more, that I should forge",,,,
1851,"Quarrels unjust against the good and loyal,",,,,
1852,Destroying them for wealth.,,,,
1853,This avarice,,,,
1854,"Sticks deeper, grows with more pernicious root",,,,
1855,"Than summer-seeming lust, and it hath been",,,,
1856,The sword of our slain kings. Yet do not fear.,,,,
1857,Scotland hath foisons to fill up your will,,,,
1858,"Of your mere own. All these are portable,",,,,
1859,With other graces weighed.,,,,
1860,"But I have none. The king-becoming graces,",,,,
1861,"As justice, verity, temp’rance, stableness,",,,,
1862,"Bounty, perseverance, mercy, lowliness,",,,,
1863,"Devotion, patience, courage, fortitude,",,,,
1864,I have no relish of them but abound,,,,
1865,"In the division of each several crime,",,,,
1866,"Acting it many ways. Nay, had I power, I should",,,,
1867,"Pour the sweet milk of concord into hell,",,,,
1868,"Uproar the universal peace, confound",,,,
1869,All unity on earth.,,,,
1870,"O Scotland, Scotland!",,,,
1871,"If such a one be fit to govern, speak.",,,,
1872,I am as I have spoken.,,,,
1873,Fit to govern?,,,,
1874,"No, not to live.—O nation miserable,",,,,
1875,"With an untitled tyrant bloody-sceptered,",,,,
1876,"When shalt thou see thy wholesome days again,",,,,
1877,Since that the truest issue of thy throne,,,,
1878,By his own interdiction stands accursed,,,,
1879,And does blaspheme his breed?—Thy royal father,,,,
1880,"Was a most sainted king. The queen that bore thee,",,,,
1881,"Oft’ner upon her knees than on her feet,",,,,
1882,Died every day she lived. Fare thee well.,,,,
1883,These evils thou repeat’st upon thyself,,,,
1884,"Hath banished me from Scotland.—O my breast,",,,,
1885,Thy hope ends here!,,,,
1886,"Macduff, this noble passion,",,,,
1887,"Child of integrity, hath from my soul",,,,
1888,"Wiped the black scruples, reconciled my thoughts",,,,
1889,To thy good truth and honor. Devilish Macbeth,,,,
1890,By many of these trains hath sought to win me,,,,
1891,"Into his power, and modest wisdom plucks me",,,,
1892,From overcredulous haste. But God above,,,,
1893,"Deal between thee and me, for even now",,,,
1894,I put myself to thy direction and,,,,
1895,"Unspeak mine own detraction, here abjure",,,,
1896,The taints and blames I laid upon myself,,,,
1897,For strangers to my nature. I am yet,,,,
1898,"Unknown to woman, never was forsworn,",,,,
1899,"Scarcely have coveted what was mine own,",,,,
1900,"At no time broke my faith, would not betray",,,,
1901,"The devil to his fellow, and delight",,,,
1902,No less in truth than life. My first false speaking,,,,
1903,Was this upon myself. What I am truly,,,,
1904,Is thine and my poor country’s to command—,,,,
1905,"Whither indeed, before thy here-approach,",,,,
1906,"Old Siward with ten thousand warlike men,",,,,
1907,"Already at a point, was setting forth.",,,,
1908,"Now we’ll together, and the chance of goodness",,,,
1909,Be like our warranted quarrel. Why are you silent?,,,,
1910,Such welcome and unwelcome things at once,,,,
1911,’Tis hard to reconcile.,,,,
1912,"Well, more anon.—",,,,
1913,"Comes the King forth, I pray you?",,,,
1914,"Ay, sir. There are a crew of wretched souls",,,,
1915,That stay his cure. Their malady convinces,,,,
1916,"The great assay of art, but at his touch",,,,
1917,(Such sanctity hath heaven given his hand),,,,
1918,They presently amend.,,,,
1919,"I thank you, doctor.",,,,
1920,What’s the disease he means?,,,,
1921,’Tis called the evil:,,,,
1922,"A most miraculous work in this good king,",,,,
1923,Which often since my here-remain in England,,,,
1924,I have seen him do. How he solicits heaven,,,,
1925,"Himself best knows, but strangely visited people",,,,
1926,"All swoll’n and ulcerous, pitiful to the eye,",,,,
1927,"The mere despair of surgery, he cures,",,,,
1928,"Hanging a golden stamp about their necks,",,,,
1929,"Put on with holy prayers; and, ’tis spoken,",,,,
1930,To the succeeding royalty he leaves,,,,
1931,"The healing benediction. With this strange virtue,",,,,
1932,"He hath a heavenly gift of prophecy,",,,,
1933,And sundry blessings hang about his throne,,,,
1934,That speak him full of grace.,,,,
1935,See who comes here.,,,,
1936,"My countryman, but yet I know him not.",,,,
1937,"My ever-gentle cousin, welcome hither.",,,,
1938,I know him now.—Good God betimes remove,,,,
1939,The means that makes us strangers!,,,,
1940,"Sir, amen.",,,,
1941,Stands Scotland where it did?,,,,
1942,"Alas, poor country,",,,,
1943,Almost afraid to know itself. It cannot,,,,
1944,"Be called our mother, but our grave, where nothing",,,,
1945,But who knows nothing is once seen to smile;,,,,
1946,Where sighs and groans and shrieks that rent the air,,,,
1947,"Are made, not marked; where violent sorrow seems",,,,
1948,A modern ecstasy. The dead man’s knell,,,,
1949,"Is there scarce asked for who, and good men’s lives",,,,
1950,"Expire before the flowers in their caps,",,,,
1951,Dying or ere they sicken.,,,,
1952,O relation too nice and yet too true!,,,,
1953,What’s the newest grief?,,,,
1954,That of an hour’s age doth hiss the speaker.,,,,
1955,Each minute teems a new one.,,,,
1956,How does my wife?,,,,
1957,"Why, well.",,,,
1958,And all my children?,,,,
1959,Well too.,,,,
1960,The tyrant has not battered at their peace?,,,,
1961,"No, they were well at peace when I did leave ’em.",,,,
1962,Be not a niggard of your speech. How goes ’t?,,,,
1963,When I came hither to transport the tidings,,,,
1964,"Which I have heavily borne, there ran a rumor",,,,
1965,Of many worthy fellows that were out;,,,,
1966,Which was to my belief witnessed the rather,,,,
1967,For that I saw the tyrant’s power afoot.,,,,
1968,Now is the time of help. Your eye in Scotland,,,,
1969,"Would create soldiers, make our women fight",,,,
1970,To doff their dire distresses.,,,,
1971,Be ’t their comfort,,,,
1972,We are coming thither. Gracious England hath,,,,
1973,Lent us good Siward and ten thousand men;,,,,
1974,An older and a better soldier none,,,,
1975,That Christendom gives out.,,,,
1976,Would I could answer,,,,
1977,This comfort with the like. But I have words,,,,
1978,"That would be howled out in the desert air,",,,,
1979,Where hearing should not latch them.,,,,
1980,What concern,,,,
1981,they—,,,,
1982,"The general cause, or is it a fee-grief",,,,
1983,Due to some single breast?,,,,
1984,No mind that’s honest,,,,
1985,"But in it shares some woe, though the main part",,,,
1986,Pertains to you alone.,,,,
1987,"If it be mine,",,,,
1988,Keep it not from me. Quickly let me have it.,,,,
1989,"Let not your ears despise my tongue forever,",,,,
1990,Which shall possess them with the heaviest sound,,,,
1991,That ever yet they heard.,,,,
1992,Hum! I guess at it.,,,,
1993,"Your castle is surprised, your wife and babes",,,,
1994,Savagely slaughtered. To relate the manner,,,,
1995,Were on the quarry of these murdered deer,,,,
1996,To add the death of you.,,,,
1997,Merciful heaven!—,,,,
1998,"What, man, ne’er pull your hat upon your brows.",,,,
1999,Give sorrow words. The grief that does not speak,,,,
2000,Whispers the o’erfraught heart and bids it break.,,,,
2001,My children too?,,,,
2002,"Wife, children, servants, all that could be found.",,,,
2003,And I must be from thence? My wife killed too?,,,,
2004,I have said.,,,,
2005,Be comforted.,,,,
2006,Let’s make us med’cines of our great revenge,,,,
2007,To cure this deadly grief.,,,,
2008,He has no children. All my pretty ones?,,,,
2009,Did you say all? O hell-kite! All?,,,,
2010,"What, all my pretty chickens and their dam",,,,
2011,At one fell swoop?,,,,
2012,Dispute it like a man.,,,,
2013,"I shall do so,",,,,
2014,But I must also feel it as a man.,,,,
2015,I cannot but remember such things were,,,,
2016,That were most precious to me. Did heaven look on,,,,
2017,"And would not take their part? Sinful Macduff,",,,,
2018,"They were all struck for thee! Naught that I am,",,,,
2019,"Not for their own demerits, but for mine,",,,,
2020,Fell slaughter on their souls. Heaven rest them now.,,,,
2021,Be this the whetstone of your sword. Let grief,,,,
2022,Convert to anger. Blunt not the heart; enrage it.,,,,
2023,"O, I could play the woman with mine eyes",,,,
2024,"And braggart with my tongue! But, gentle heavens,",,,,
2025,Cut short all intermission! Front to front,,,,
2026,Bring thou this fiend of Scotland and myself.,,,,
2027,"Within my sword’s length set him. If he ’scape,",,,,
2028,Heaven forgive him too.,,,,
2029,This tune goes manly.,,,,
2030,"Come, go we to the King. Our power is ready;",,,,
2031,Our lack is nothing but our leave. Macbeth,,,,
2032,"Is ripe for shaking, and the powers above",,,,
2033,Put on their instruments. Receive what cheer you,,,,
2034,may.,,,,
2035,The night is long that never finds the day.,,,,
2036,I have two nights watched with you but can,,,,
2037,perceive no truth in your report. When was it she,,,,
2038,last walked?,,,,
2039,"Since his Majesty went into the field, I",,,,
2040,"have seen her rise from her bed, throw her nightgown",,,,
2041,"upon her, unlock her closet, take forth paper,",,,,
2042,"fold it, write upon ’t, read it, afterwards seal it, and",,,,
2043,again return to bed; yet all this while in a most fast,,,,
2044,sleep.,,,,
2045,"A great perturbation in nature, to receive at",,,,
2046,once the benefit of sleep and do the effects of,,,,
2047,"watching. In this slumb’ry agitation, besides her",,,,
2048,"walking and other actual performances, what at any",,,,
2049,time have you heard her say?,,,,
2050,"That, sir, which I will not report after",,,,
2051,her.,,,,
2052,"You may to me, and ’tis most meet you",,,,
2053,should.,,,,
2054,"Neither to you nor anyone, having no",,,,
2055,witness to confirm my speech.,,,,
2056,"Lo you, here she comes. This is her very guise and,",,,,
2057,"upon my life, fast asleep. Observe her; stand close.",,,,
2058,How came she by that light?,,,,
2059,"Why, it stood by her. She has light by",,,,
2060,her continually. ’Tis her command.,,,,
2061,You see her eyes are open.,,,,
2062,"Ay, but their sense are shut.",,,,
2063,What is it she does now? Look how she rubs,,,,
2064,her hands.,,,,
2065,It is an accustomed action with her to,,,,
2066,seem thus washing her hands. I have known her,,,,
2067,continue in this a quarter of an hour.,,,,
2068,Yet here’s a spot.,,,,
2069,"Hark, she speaks. I will set down what comes",,,,
2070,"from her, to satisfy my remembrance the more",,,,
2071,strongly.,,,,
2072,"Out, damned spot, out, I say! One. Two.",,,,
2073,"Why then, ’tis time to do ’t. Hell is murky. Fie, my",,,,
2074,"lord, fie, a soldier and afeard? What need we fear",,,,
2075,"who knows it, when none can call our power to",,,,
2076,account? Yet who would have thought the old man,,,,
2077,to have had so much blood in him?,,,,
2078,Do you mark that?,,,,
2079,The Thane of Fife had a wife. Where is,,,,
2080,"she now? What, will these hands ne’er be clean? No",,,,
2081,"more o’ that, my lord, no more o’ that. You mar all",,,,
2082,with this starting.,,,,
2083,"Go to, go to. You have known what you should",,,,
2084,not.,,,,
2085,"She has spoke what she should not,",,,,
2086,I am sure of that. Heaven knows what she has,,,,
2087,known.,,,,
2088,Here’s the smell of the blood still. All,,,,
2089,the perfumes of Arabia will not sweeten this little,,,,
2090,"hand. O, O, O!",,,,
2091,What a sigh is there! The heart is sorely,,,,
2092,charged.,,,,
2093,I would not have such a heart in my,,,,
2094,bosom for the dignity of the whole body.,,,,
2095,"Well, well, well.",,,,
2096,"Pray God it be, sir.",,,,
2097,This disease is beyond my practice. Yet I have,,,,
2098,"known those which have walked in their sleep,",,,,
2099,who have died holily in their beds.,,,,
2100,Wash your hands. Put on your nightgown.,,,,
2101,"Look not so pale. I tell you yet again, Banquo’s",,,,
2102,buried; he cannot come out on ’s grave.,,,,
2103,Even so?,,,,
2104,"To bed, to bed. There’s knocking at the",,,,
2105,"gate. Come, come, come, come. Give me your",,,,
2106,"hand. What’s done cannot be undone. To bed, to",,,,
2107,"bed, to bed.",,,,
2108,Will she go now to bed?,,,,
2109,Directly.,,,,
2110,Foul whisp’rings are abroad. Unnatural deeds,,,,
2111,Do breed unnatural troubles. Infected minds,,,,
2112,To their deaf pillows will discharge their secrets.,,,,
2113,More needs she the divine than the physician.,,,,
2114,"God, God forgive us all. Look after her.",,,,
2115,Remove from her the means of all annoyance,,,,
2116,"And still keep eyes upon her. So, good night.",,,,
2117,"My mind she has mated, and amazed my sight.",,,,
2118,I think but dare not speak.,,,,
2119,"Good night, good doctor.",,,,
2120,"The English power is near, led on by Malcolm,",,,,
2121,"His uncle Siward, and the good Macduff.",,,,
2122,"Revenges burn in them, for their dear causes",,,,
2123,Would to the bleeding and the grim alarm,,,,
2124,Excite the mortified man.,,,,
2125,Near Birnam Wood,,,,
2126,Shall we well meet them. That way are they coming.,,,,
2127,Who knows if Donalbain be with his brother?,,,,
2128,"For certain, sir, he is not. I have a file",,,,
2129,Of all the gentry. There is Siward’s son,,,,
2130,And many unrough youths that even now,,,,
2131,Protest their first of manhood.,,,,
2132,What does the tyrant?,,,,
2133,Great Dunsinane he strongly fortifies.,,,,
2134,Some say he’s mad; others that lesser hate him,,,,
2135,Do call it valiant fury. But for certain,,,,
2136,He cannot buckle his distempered cause,,,,
2137,Within the belt of rule.,,,,
2138,Now does he feel,,,,
2139,His secret murders sticking on his hands.,,,,
2140,Now minutely revolts upbraid his faith-breach.,,,,
2141,"Those he commands move only in command,",,,,
2142,Nothing in love. Now does he feel his title,,,,
2143,"Hang loose about him, like a giant’s robe",,,,
2144,Upon a dwarfish thief.,,,,
2145,"Who, then, shall blame",,,,
2146,His pestered senses to recoil and start,,,,
2147,When all that is within him does condemn,,,,
2148,Itself for being there?,,,,
2149,"Well, march we on",,,,
2150,To give obedience where ’tis truly owed.,,,,
2151,"Meet we the med’cine of the sickly weal,",,,,
2152,And with him pour we in our country’s purge,,,,
2153,Each drop of us.,,,,
2154,Or so much as it needs,,,,
2155,To dew the sovereign flower and drown the weeds.,,,,
2156,Make we our march towards Birnam.,,,,
2157,Bring me no more reports. Let them fly all.,,,,
2158,Till Birnam Wood remove to Dunsinane,,,,
2159,I cannot taint with fear. What’s the boy Malcolm?,,,,
2160,Was he not born of woman? The spirits that know,,,,
2161,All mortal consequences have pronounced me thus:,,,,
2162,"Fear not, Macbeth. No man that’s born of woman",,,,
2163,"Shall e’er have power upon thee. Then fly, false",,,,
2164,"thanes,",,,,
2165,And mingle with the English epicures.,,,,
2166,The mind I sway by and the heart I bear,,,,
2167,Shall never sag with doubt nor shake with fear.,,,,
2168,"The devil damn thee black, thou cream-faced loon!",,,,
2169,Where got’st thou that goose-look?,,,,
2170,There is ten thousand—,,,,
2171,"Geese, villain?",,,,
2172,"Soldiers, sir.",,,,
2173,"Go prick thy face and over-red thy fear,",,,,
2174,"Thou lily-livered boy. What soldiers, patch?",,,,
2175,Death of thy soul! Those linen cheeks of thine,,,,
2176,"Are counselors to fear. What soldiers, whey-face?",,,,
2177,"The English force, so please you.",,,,
2178,Take thy face hence.,,,,
2179,Seyton!—I am sick at heart,,,,
2180,"When I behold—Seyton, I say!—This push",,,,
2181,Will cheer me ever or disseat me now.,,,,
2182,I have lived long enough. My way of life,,,,
2183,"Is fall’n into the sere, the yellow leaf,",,,,
2184,"And that which should accompany old age,",,,,
2185,"As honor, love, obedience, troops of friends,",,,,
2186,"I must not look to have, but in their stead",,,,
2187,"Curses, not loud but deep, mouth-honor, breath",,,,
2188,Which the poor heart would fain deny and dare,,,,
2189,not.—,,,,
2190,Seyton!,,,,
2191,What’s your gracious pleasure?,,,,
2192,What news more?,,,,
2193,"All is confirmed, my lord, which was reported.",,,,
2194,I’ll fight till from my bones my flesh be hacked.,,,,
2195,Give me my armor.,,,,
2196,’Tis not needed yet.,,,,
2197,I’ll put it on.,,,,
2198,Send out more horses. Skirr the country round.,,,,
2199,Hang those that talk of fear. Give me mine,,,,
2200,armor.—,,,,
2201,"How does your patient, doctor?",,,,
2202,"Not so sick, my lord,",,,,
2203,As she is troubled with thick-coming fancies,,,,
2204,That keep her from her rest.,,,,
2205,Cure her of that.,,,,
2206,"Canst thou not minister to a mind diseased,",,,,
2207,"Pluck from the memory a rooted sorrow,",,,,
2208,"Raze out the written troubles of the brain,",,,,
2209,And with some sweet oblivious antidote,,,,
2210,Cleanse the stuffed bosom of that perilous stuff,,,,
2211,Which weighs upon the heart?,,,,
2212,Therein the patient,,,,
2213,Must minister to himself.,,,,
2214,Throw physic to the dogs. I’ll none of it.—,,,,
2215,"Come, put mine armor on. Give me my staff.",,,,
2216,"Seyton, send out.—Doctor, the thanes fly from",,,,
2217,me.—,,,,
2218,"Come, sir, dispatch.—If thou couldst, doctor, cast",,,,
2219,"The water of my land, find her disease,",,,,
2220,"And purge it to a sound and pristine health,",,,,
2221,I would applaud thee to the very echo,,,,
2222,"That should applaud again.—Pull ’t off, I say.—",,,,
2223,"What rhubarb, senna, or what purgative drug",,,,
2224,Would scour these English hence? Hear’st thou of,,,,
2225,them?,,,,
2226,"Ay, my good lord. Your royal preparation",,,,
2227,Makes us hear something.,,,,
2228,Bring it after me.—,,,,
2229,I will not be afraid of death and bane,,,,
2230,Till Birnam Forest come to Dunsinane.,,,,
2231,"Were I from Dunsinane away and clear,",,,,
2232,Profit again should hardly draw me here.,,,,
2233,"Cousins, I hope the days are near at hand",,,,
2234,That chambers will be safe.,,,,
2235,We doubt it nothing.,,,,
2236,What wood is this before us?,,,,
2237,The Wood of Birnam.,,,,
2238,Let every soldier hew him down a bough,,,,
2239,And bear ’t before him. Thereby shall we shadow,,,,
2240,The numbers of our host and make discovery,,,,
2241,Err in report of us.,,,,
2242,It shall be done.,,,,
2243,We learn no other but the confident tyrant,,,,
2244,Keeps still in Dunsinane and will endure,,,,
2245,Our setting down before ’t.,,,,
2246,’Tis his main hope;,,,,
2247,"For, where there is advantage to be given,",,,,
2248,"Both more and less have given him the revolt,",,,,
2249,And none serve with him but constrainèd things,,,,
2250,Whose hearts are absent too.,,,,
2251,Let our just censures,,,,
2252,"Attend the true event, and put we on",,,,
2253,Industrious soldiership.,,,,
2254,The time approaches,,,,
2255,That will with due decision make us know,,,,
2256,What we shall say we have and what we owe.,,,,
2257,"Thoughts speculative their unsure hopes relate,",,,,
2258,But certain issue strokes must arbitrate;,,,,
2259,"Towards which, advance the war.",,,,
2260,Hang out our banners on the outward walls.,,,,
2261,The cry is still They come! Our castle’s strength,,,,
2262,Will laugh a siege to scorn. Here let them lie,,,,
2263,Till famine and the ague eat them up.,,,,
2264,Were they not forced with those that should be,,,,
2265,"ours,",,,,
